{
  "schema_version": 2,
  "record_type": "MILESTONE_CHECKPOINT",
  "record_id": "CHECKPOINT-DEMO-001",
  "goal_id": "GOAL-DEMO-001",
  "goal_version": 1,
  "event_sequence": 1,
  "reason": "PLAN_FROZEN",
  "created_at": "2026-07-21T12:00:00Z",
  "protected_state": {
    "objective": "Implement exact recovery.",
    "acceptance_contract": { "id": "AC-PCH-1.0", "sha256": "0000000000000000000000000000000000000000000000000000000000000000" },
    "constraints": [{ "id": "CON-DEMO-001", "sha256": "1111111111111111111111111111111111111111111111111111111111111111" }],
    "latest_correction": null,
    "assumptions": [{ "id": "ASM-DEMO-001", "sha256": "2222222222222222222222222222222222222222222222222222222222222222" }],
    "requirement_revision": { "id": "REQ-DEMO-001", "sha256": "3333333333333333333333333333333333333333333333333333333333333333" },
    "plan_revision": { "id": "PLAN-DEMO-001", "sha256": "4444444444444444444444444444444444444444444444444444444444444444" },
    "execution_phase": "PLANNING",
    "current_stage": null,
    "next_action": "Enter the BuildEntryGate.",
    "pending_effects": [],
    "receipts": [{ "id": "RCP-DEMO-001", "sha256": "5555555555555555555555555555555555555555555555555555555555555555" }],
    "failure_signatures": [],
    "route_decision": null,
    "active_performance_trial": null,
    "prompt_generation": { "id": "PROMPT-GEN-DEMO-002", "sha256": "8888888888888888888888888888888888888888888888888888888888888888" },
    "prompt_request": { "id": "PROMPT-REQ-DEMO-002", "sha256": "9999999999999999999999999999999999999999999999999999999999999999" },
    "cache_lineage": null,
    "response_contract": null,
    "evidence_frontier": [],
    "lease_generation": 1
  },
  "protected_state_sha256": "6666666666666666666666666666666666666666666666666666666666666666",
  "prev_checkpoint_sha256": null,
  "record_sha256": "7777777777777777777777777777777777777777777777777777777777777777"
}
